{
  "schemaVersion": "session-trace.v1",
  "name": "external-assistant-response-import",
  "description": "A response pasted from an external chat app becomes a completed playable assistant turn.",
  "runtimeProfile": "phone-tablet-online",
  "requiresCapabilities": {
    "playback": ["assistant_turn_tts"],
    "sync": ["canonical_persistence"]
  },
  "fixtures": {
    "item": "fixtures/items/text-with-listening-map.json",
    "session": "fixtures/sessions/summary-addendum-discussion.json"
  },
  "steps": [
    {
      "command": "importAssistantResponse",
      "args": {
        "text": "<sm_summary>External response summary.</sm_summary><sm_response>External response first point. External response second point.</sm_response>",
        "autoPlay": true
      },
      "expect": {
        "phase": "ai_response_playback",
        "targetType": "assistant_turn_tts",
        "turnStatus": "complete"
      }
    },
    {
      "command": "beginInterjection",
      "expect": {
        "phase": "recording_interjection",
        "recordingTargetId": "turn-response-001"
      }
    },
    {
      "command": "finishInterjection",
      "args": { "audioRef": "interjections/external-response-001.m4a" },
      "expect": {
        "phase": "ai_response_playback",
        "lastInterjectionTargetType": "assistant_turn",
        "lastInterjectionAnchorType": "turn"
      }
    }
  ],
  "assertions": [
    "Pasted assistant output is represented as a normal completed assistant turn.",
    "Imported response playback supports the same turn-anchor interjection lifecycle as provider-generated responses."
  ]
}
